<?xml version="1.0" encoding="UTF-8"?>
<xs:schema xmlns:xs="http://www.w3.org/2001/XMLSchema"
			targetNamespace="http://vavatech.pl/osoby4"
			xmlns:tns="http://vavatech.pl/osoby4">
	
	<xs:element name="osoba">
		<xs:complexType>
			<xs:sequence>
				<xs:element name="imie" type="xs:string" maxOccurs="3"/>
				<xs:element name="nazwisko" type="xs:string"/>
				<xs:element name="data-urodzenia" type="xs:date" minOccurs="0"/>

				<!-- Odwołanie się do globalnej definicji elementu -->
				<xs:element ref="tns:adres"/>
			</xs:sequence>
		</xs:complexType>
	</xs:element>
	
	<!-- Globalna definicja elementu. -->
	<xs:element name="adres">
		<xs:complexType>
			<xs:sequence>
				<xs:element name="ulica" type="xs:string"/>
				<xs:element name="nr-domu" type="xs:string"/>
				<xs:element name="nr-mieszkania" type="xs:string" minOccurs="0"/>
				<xs:element name="kod-pocztowy" type="xs:string"/>
				<xs:element name="miejscowosc" type="xs:string"/>
			</xs:sequence>
		</xs:complexType>
	</xs:element>
	
</xs:schema>