<?xml version="1.0" encoding="UTF-8"?>
<osoba xmlns="http://vavatech.pl/osoby4"
	xmlns:xsi="http://www.w3.org/2001/XMLSchema-instance"
	xsi:schemaLocation="http://vavatech.pl/osoby4 osoby4.xsd ">
	
<!-- Ten dokument się  nie waliduje, gdyż zgodnie ze schematem 4 element imie nie powinien należeć do NS, a należy z powodu domyślnej przestrzeni nazw -->
  <imie>imie</imie>
  <nazwisko>nazwisko</nazwisko>
  <data-urodzenia>2001-01-01</data-urodzenia>
  <adres>
    <ulica>ulica</ulica>
    <nr-domu>nr-domu</nr-domu>
    <nr-mieszkania>nr-mieszkania</nr-mieszkania>
    <kod-pocztowy>kod-pocztowy</kod-pocztowy>
    <miejscowosc>miejscowosc</miejscowosc>
  </adres>
</osoba>
