<?xml version="1.0" encoding="UTF-8"?>
<p:osoba xmlns:p="http://vavatech.pl/osoby4" xmlns:xsi="http://www.w3.org/2001/XMLSchema-instance" xsi:schemaLocation="http://vavatech.pl/osoby4 osoby4.xsd ">
  <imie>imie</imie>
  <nazwisko>nazwisko</nazwisko>
  <data-urodzenia>2001-01-01</data-urodzenia>
  <p:adres>
    <ulica>ulica</ulica>
    <nr-domu>nr-domu</nr-domu>
    <nr-mieszkania>nr-mieszkania</nr-mieszkania>
    <kod-pocztowy>kod-pocztowy</kod-pocztowy>
    <miejscowosc>miejscowosc</miejscowosc>
  </p:adres>
</p:osoba>
